{
    "id": 2643743,
    "coord": {
      "lon": -0.1257,
      "lat": 51.5085
    },
    "weather": [
      {
        "id": 804,
        "main": "Clouds",
        "description": "overcast clouds",
        "icon": "04d"
      }
    ],
    "base": "stations",
    "main": {
      "temp": 285.84,
      "feels_like": 284.89,
      "temp_min": 284.82,
      "temp_max": 287.04,
      "pressure": 1010,
      "humidity": 66
    },
    "visibility": 10000,
    "wind": {
      "speed": 2.06,
      "deg": 330
    },
    "clouds": {
      "all": 90
    },
    "dt": 1621005765,
    "sys": {
      "type": 1,
      "id": 1414,
      "country": "GB",
      "sunrise": 1620965402,
      "sunset": 1621021429
    },
    "timezone": 3600,
    "name": "London",
    "cod": 200
}